{
  "schema_version": 1,
  "candidate_sha": "9d9d9d9d9d9d9d9d9d9d9d9d9d9d9d9d9d9d9d9d",
  "evidence_schema_digest": "sha256:0000000000000000000000000000000000000000000000000000000000000000",
  "observation_schema_digest": "sha256:0000000000000000000000000000000000000000000000000000000000000000",
  "generated_at": "2026-08-05T14:00:00Z",
  "entries": [],
  "run_status": "fail"
}
